Pesquisador Responsável,Pesquisadores Principais (Atuais),Pesquisadores Principais (Últimos),Pesquisadores Principais (Anteriores),Pesquisadores Associados
Leticia de Almeida,Não Informado,Não Informado,Não Informado,Djalma de Souza Lima Júnior
Ricardo Bonfim Silva,Gustavo Alencastro Veiga Cruzeiro,Não Informado,Não Informado,Camila Morais Melo - Carlos Alberto Oliveira de Biagi Júnior - Elvis Terci Valera - Felipe D'Almeida Costa - Maristella Bergamo Francisco dos Reis - Rodrigo Farinaccio Lotrario
Robson Luis Ferraz do Amaral,Não Informado,Não Informado,Não Informado,Mateus Frederico de Paula
Daniela Silvestrini Fernandes,Gabriela Cristina Silva Prado,Não Informado,Não Informado,Cristiano Ceron Jayme - Luciana Nogueira de Sousa Andrade - Miyuki Uno - Roger Chammas
Carolina Caliári Oliveira,Não Informado,Não Informado,Não Informado,Adriana Oliveira Manfiolli - Ana Augusta Pagnano Derussi
Rafael Mira de Oliveira Libardi,"Dyonnatan Ferreira Maia, Nicolau Elias Pena Ramalho",Não Informado,Não Informado,Não Informado
Décio Batista de Freitas Neto,João Victor Bonaldo Rodrigues Rocha,Não Informado,Não Informado,Herenilton Paulino Oliveira - Paulo Olivi
Nerry Tatiana Cecilio,Não Informado,Não Informado,Não Informado,Não Informado
Luciana Baroni,Não Informado,Não Informado,Não Informado,Ana Patricia Yatsuda Natsui
Thaís Carvalho Maester Casanova,Não Informado,Rodrigo Nery,Não Informado,Não Informado
Rita Maria Borges de Moraes,Não Informado,Miriam Verginia Lourenço,Não Informado,Não Informado
Daniela Nakandakari Goia,Não Informado,Gustavo Trindade Valio,Não Informado,Marisa de Cássia Registro Fonseca
Amanda Carolina Prado de Moraes,Não Informado,Não Informado,Não Informado,Emerson Rodrigues de Camargo - Paulo Teixeira Lacava
Guilherme Jorge Gomes de Sousa,"Diego Moure Oliveira, Joyce Mayra Volpini Almeida Dias",Não Informado,"Diego Moure Oliveira, Joyce Mayra Volpini Almeida Dias",Andresa Aparecida Berretta e Silva - Carlos Pamplona Rehder - Jorge Luis Silva Kavicki
Bruna Moretto Rodrigues,Não Informado,Não Informado,Não Informado,Andrei Félix de Oliveira - Antonio Augusto Tupinambá Bertelli - Bruna Frizzo Rabelo - Carolina Ferraz da Silva - Isabela Fernanda Morales Martins - Miriane de Oliveira - Renato Mendes Rossi De Lucca
Paula Cristina dos Santos,Não Informado,Não Informado,Não Informado,Não Informado
Paula Fagundes de Gouvêa Bizzi,Não Informado,Não Informado,Não Informado,Jean Carlos Rodrigues da Silva - Sabrina Ciane Condi - Taisa Magnani Dinamarco
Daniel Roberto Callejon,Não Informado,Não Informado,Não Informado,Pedro Paulo Soldati
Maíra Peres Ferreira Duarte,Não Informado,Não Informado,Não Informado,Não Informado
Rafael Silva Rocha,Não Informado,Não Informado,Não Informado,Gustavo Tamasco - Lucas Bigolin Lorenzon - María Eugenia Guazzaroni - Stela Virgilio
Mariana Zuccherato Bocato Kimachi,Não Informado,Não Informado,Não Informado,Reverson Fernandes Quero
Larissa Galante Elias,Não Informado,Não Informado,"Bárbara Gimenes de Castro, Marcus Vinícius Wendel Jordão",Daniela Oliveira Carneiro - Vanessa Mendes
Carlos Fernando Baltieri,Não Informado,Não Informado,Não Informado,Gustavo Trindade Valio - Wanessa Melchert Mattos - Winston Pinheiro Claro Gomes
Marcelo Domingos,Não Informado,Não Informado,Não Informado,Não Informado
Marcel Montels Trevisani,Não Informado,Não Informado,Não Informado,Não Informado
Décio Batista de Freitas Neto,Não Informado,João Victor Bonaldo Rodrigues Rocha,Não Informado,Herenilton Paulino Oliveira - Herenilton Paulino Oliveira
Cristiano Ceron Jayme,Não Informado,Não Informado,Não Informado,Não Informado
Ana Carolina Rodrigues Montes,Não Informado,Não Informado,Não Informado,Luis Alexandre Pedro de Freitas - Luís Victor Dantas de Freitas
Diego Moure Oliveira,Não Informado,"Guilherme Jorge Gomes de Sousa, Joyce Mayra Volpini Almeida Dias",Não Informado,Andresa Aparecida Berretta e Silva - Carlos Pamplona Rehder - Jorge Luis Silva Kavicki
Renato Mantelli Picoli,Não Informado,Eduardo Fonseca de Almeida,"Eduardo Fonseca de Almeida, Matheus Camargo",Não Informado
Mário César Souza e Silva,Não Informado,Não Informado,Não Informado,Não Informado
Vanessa Leiria Campo,Não Informado,Não Informado,Não Informado,Carlos Alessandro Fuzo - João Luis Callegari Lopes - Marcelo Dias Baruffi - Valter Eduardo Murie
Carla Souza,Não Informado,Osvaldo de Freitas,Osvaldo de Freitas,Adriana Oliveira Manfiolli - Carolina Caliári Oliveira - Nayara Cristina Perez de Albuquerque
Joyce Mayra Volpini Almeida Dias,Não Informado,Não Informado,Não Informado,Andresa Aparecida Berretta e Silva - Carlos Pamplona Rehder - Diego Moure Oliveira
Adriana Oliveira Manfiolli,Não Informado,Não Informado,Não Informado,Carolina Caliári Oliveira
Thais Carvalho Brito Oliveira,Não Informado,Não Informado,Não Informado,Não Informado
Miriane de Oliveira,Não Informado,Não Informado,Não Informado,Ana Carolina de Oliveira Mafra - Andrei Félix de Oliveira - Bruna Moretto Rodrigues - Flavio Mavignier Cárcano - Gustavo Ramos Teixeira - Marcos Tadeu dos Santos - Mirela Cristina Moreira Prates - Nathalia de Campos Rodrigues - Suzana Rodrigues de Araujo
Shaiani Maria Gil de Melo,Não Informado,Não Informado,Não Informado,Não Informado
Juliana Magro Ribeiro,Não Informado,Não Informado,Não Informado,Adriana Oliveira Manfiolli - Carolina Caliári Oliveira - Francisco Jean Pierre Romero Febres - Mario Taba Junior - Valessa Florindo Carvalho
Andrey Omar Mozo Uscamayta,Não Informado,Não Informado,Não Informado,Gerson Hiroshi Yoshinari Júnior
Robson Luis Ferraz do Amaral,Não Informado,Não Informado,Não Informado,Fernanda Maris Peria - Roger Chammas
Thiago Franco,Não Informado,André Luiz Teixeira Vinci,André Luiz Teixeira Vinci,Renato Tinós
Carolina Caliári Oliveira,Não Informado,Não Informado,Não Informado,Adriana Oliveira Manfiolli - Maria Carolina de Oliveira Rodrigues - Maristela Delgado Orellana
Marcos Tadeu dos Santos,Não Informado,Não Informado,Não Informado,Andrei Félix de Oliveira - Bruna Moretto Rodrigues - Bruno Mari Fredi - Diego Nogueira Vilela - Maria Paula Martins Januario - Mirela Cristina Moreira Prates - Sandro Paino Paim - Suzana Rodrigues de Araujo
Tânia Petta,Não Informado,"Mariane Molina Buffo, Raquel Tassara Nogueira","Mariane Molina Buffo, Raquel Tassara Nogueira",Franklin Behlau - Luiz Alberto Beraldo de Moraes
Camila Nunes Lemos,Não Informado,Não Informado,Não Informado,Bianca Aparecida Martin - Luciana Facco Dalmolin - Renata Fonseca Vianna Lopez - Rogerio Nunes Lemos
Carla Souza,Não Informado,Não Informado,Não Informado,Adriana Oliveira Manfiolli - Carolina Caliári Oliveira
Renan Medico da Silva,Não Informado,Não Informado,Não Informado,Fabio Alves Teixeira - Felipe Marcelo Pereira dos Santos - Luísa Czamanski Nora - Rafael Silva Rocha
José Francisco Torres,Não Informado,Não Informado,Não Informado,Paulo Seleghim Júnior
Anthony Alexandre Weil,Não Informado,Não Informado,Não Informado,Eudes Leonnan Gomes de Medeiros - Romualdo Rodrigues Menezes
Marcel Montels Trevisani,Não Informado,Não Informado,Não Informado,Não Informado
Rita Maria Borges de Moraes,Não Informado,Miriam Verginia Lourenço,Miriam Verginia Lourenço,Antonio Luiz Cerdeira
Ricardo Bonfim Silva,Não Informado,Gustavo Alencastro Veiga Cruzeiro,Gustavo Alencastro Veiga Cruzeiro,Carlos Alberto Oliveira de Biagi Júnior - Elvis Terci Valera - Maristella Bergamo Francisco dos Reis
Carlo Rondinoni,Não Informado,Não Informado,Não Informado,Antonio Adilton Oliveira Carneiro - Helio Rubens Machado - Helton Luiz Aparecido Defino - Oswaldo Baffa Filho
Juan Harold Sosa Arnao,Não Informado,Não Informado,Não Informado,Justo Emilio Alvarez Jácobo
Diego Moure Oliveira,Não Informado,Joyce Mayra Volpini Almeida Dias,Não Informado,Carlos Pamplona Rehder - Guilherme Jorge Gomes de Sousa
João Luis Callegari Lopes,Não Informado,Não Informado,Não Informado,Fernanda Peres Ferreira - Giuliano Cesar Clososki - Leandro Alves Bozzini - Maria Paula Garofo Peixoto - Thais Guaratini
Juliana Magro Ribeiro,Não Informado,Não Informado,Não Informado,Adriana Oliveira Manfiolli - Carolina Caliári Oliveira - Gabriela Cerminaro Rodrigues
Rodrigo Aznar Mendes,Não Informado,Evanir Araújo da Conceição,Evanir Araújo da Conceição,Não Informado
Luis Gustavo Silva Scarpari,Não Informado,José Ricardo Silva Scarpari,José Ricardo Silva Scarpari,Elitamara Morsoletto - Igor do Nascimento Drago - Roberto Gil Annes da Silva
Bruna Moretto Rodrigues,Não Informado,Não Informado,Não Informado,Ana Paula Carneiro dos Santos - Andrei Félix de Oliveira - Cléber Pinto Camacho - Fabiano Mesquita Callegari - Flávia Gaona de Oliveira Gennaro - João Roberto Maciel Martins - Marcos Tadeu dos Santos
Ana Carolina Rodrigues Montes,Não Informado,Não Informado,Não Informado,Luis Alexandre Pedro de Freitas - Luís Victor Dantas de Freitas
Tatiana Magalhães,Não Informado,Não Informado,Não Informado,Lucas Garcia von Zuben - NILCE NAOMI KOBORI - Túlio Marcos Nunes
Diego Fiori de Carvalho,Não Informado,Não Informado,Não Informado,Harley Francisco de Oliveira
Thaís Carvalho Maester Casanova,Não Informado,Não Informado,Não Informado,Erica Mendes Lopes
Robson Luis Ferraz do Amaral,Não Informado,Não Informado,Não Informado,Fernanda Maris Peria - Kamilla Swiech Antonietto
Larissa Galante Elias,Não Informado,"Bárbara Matos Do Prado, Túlio Marcos Nunes",Não Informado,Cristiano Menezes - David De Jong - Filipe Jose Dal Bo de Andrade - Gabriel Moura Mascarin - Lucas Garcia von Zuben
Jose Gonçalves Franco Junior,Não Informado,"Antonio Hélio Oliani, Laura Diniz Vagnini Alavarse",Não Informado,Adriana Renzi - Ana Lúcia Mauri - Joao Batista Alcantara Oliveira
Adriana Ferreira Lopes Vilela,Não Informado,Não Informado,Não Informado,Juliana Maria de Lima
Carla Carolina Munari,Não Informado,Não Informado,Não Informado,Ana Luiza Scarano Aguillera Forte - Ana Marisa Chudzinski-Tavassi - Denise Crispim Tavares - Nayara Cristina Perez de Albuquerque
Hilton Vicente César,Não Informado,Não Informado,Não Informado,Jorge Elias Júnior - Paulo Mazzoncini de Azevedo Marques
Tânia Petta,Não Informado,Não Informado,Não Informado,Franklin Behlau - Luiz Alberto Beraldo de Moraes
Luiz Carlos de Oliveira,Não Informado,Não Informado,Não Informado,Não Informado
José Antonio Camacho Guerrero,Não Informado,Não Informado,Não Informado,Harley Francisco de Oliveira
Lucas Madureira dos Anjos,Não Informado,Não Informado,Não Informado,André Luiz Martins Pignata - Luciana Oranges Cezarino - Rafael Madureira dos Anjos - Rodrigo Palucci Pantoni
Carlo Rondinoni,Não Informado,Não Informado,Não Informado,Antonio Adilton Oliveira Carneiro - Helio Rubens Machado - Helton Luiz Aparecido Defino - Oswaldo Baffa Filho - Renan Hiroshi Matsuda - Theo Zeferino Pavan
Adriana Oliveira Manfiolli,Não Informado,Não Informado,Não Informado,Carolina Caliári Oliveira - Claudio Miguel da Costa Neto - Kamilla Swiech Antonietto - Kelen Cristina Ribeiro Malmegrim de Farias
Rafael Mira de Oliveira Libardi,Não Informado,Não Informado,Não Informado,Emanuel Carlos de Alcantara Valente - Lucas da Silva Assis
Daniela Spuri Bernardi,Não Informado,Não Informado,Não Informado,Não Informado
Vanessa Leiria Campo,Não Informado,Não Informado,Não Informado,Marcelo Dias Baruffi - Marcelo Fiori Marchiori
Hugo Cesar Pessotti,Não Informado,Juliana Tarossi Pollettini,Juliana Tarossi Pollettini,Não Informado
Larissa Galante Elias,Não Informado,"Lucas Garcia von Zuben, Tatiana Magalhães, Túlio Marcos Nunes",Não Informado,Cristiano Menezes - Filipe Jose Dal Bo de Andrade
Fernanda Rebel Moreira Alves,Não Informado,Não Informado,Não Informado,Alceu Afonso Jordão Junior - Andresa Aparecida Berretta e Silva - Franciane Marquele de Oliveira - Paula Garcia Chiarello
Ana Luiza Scarano Aguillera Forte,Não Informado,Não Informado,Não Informado,Maria José Vieira Fonseca
Alexandre Martinewski,Não Informado,Não Informado,Não Informado,Não Informado
Rita Maria Borges de Moraes,Não Informado,Miriam Verginia Lourenço,Não Informado,Não Informado
Daniel Blasioli Dentillo,Não Informado,Dante Gavio,Dante Gavio,Regina Célia Moreira
Raysildo Barbosa Lôbo,Não Informado,Não Informado,Não Informado,Fernando Sebastián Baldi Rey - Luiz Antonio Framartino Bezerra - Washington Luiz Olivato Assagra
Thaís Carvalho Maester Casanova,Não Informado,Não Informado,Não Informado,Não Informado
Luiz Carlos de Oliveira,Não Informado,Não Informado,Não Informado,Não Informado
Marcos Tadeu dos Santos,Não Informado,Não Informado,Não Informado,Ana Lígia Buzolin - André Lopes Carvalho - Cristiano Claudino Oliveira - Cristovam Scapulatempo Neto - David Livingstone Alves Figueiredo - Edna Teruko Kimura - Fabiano Mesquita Callegari - Gabriela Brenta - Gisah Amaral de Carvalho - Gláucia Maria Ferreira da Silva Mazeto - Icleia Siqueira Barreto - Laura Sterian - Léa Maria Zanini Maciel - Mauro Tadeu Ajaj Saieg - Ricardo Ribeiro Gama
Daniel Roberto Callejon,Não Informado,Não Informado,Não Informado,Fernando de Queiroz Cunha - José Carlos Farias Alves Filho - Thiago Mattar Cunha
Mario Sérgio Adolfi Júnior,Não Informado,Não Informado,Não Informado,Não Informado
Felipe Wilker Grillo,Não Informado,Não Informado,Não Informado,Não Informado
Caio Margarido Moreira,Não Informado,Milton Augusto Vendramini de Ávila,Milton Augusto Vendramini de Ávila,Julio Cesar Anastacio - Marco Antonio Di Bonifacio
Franciane Marquele de Oliveira,Não Informado,Não Informado,Não Informado,Anderson Rodrigo Moraes de Oliveira - CAMILA INDIANI DE OLIVEIRA - Denise Crispim Tavares - Eduardo Barbosa Coelho - Jéssica Rebouças Silva - Maraine Catarina Tadini - Nayara Cristina Perez de Albuquerque - Valeria de Matos Borges
Andresa Aparecida Berretta e Silva,Não Informado,"Carlos Pamplona Rehder, Guilherme Jorge Gomes de Sousa, Joyce Mayra Volpini Almeida Dias","Carlos Pamplona Rehder, Guilherme Jorge Gomes de Sousa, Joyce Mayra Volpini Almeida Dias",Andresa Piacezzi Nascimento Rodrigues - Breno Magalhães Freitas - Bruno Alves Rocha - Cristiano Menezes - Fernando Barbosa Júnior
Thaila Fernanda dos Reis,Não Informado,Não Informado,Não Informado,Andresa Aparecida Berretta e Silva - Gustavo Henrique Goldman
Tais Aleriana Lucon Wagemaker,Não Informado,Não Informado,Não Informado,Patrícia Mazureki Campos
Juan Harold Sosa Arnao,Não Informado,"Delia Rita Tapia Blácido, Leonardo Paes Rangel, Reynaldo Palacios Bereche, Silvia Azucena Nebra de Pérez, Song Won Park",Não Informado,Carolina Lopez Castrillon - Edgar Fernando Cortes Rodriguez
Stefano Guimarães Velludo,Não Informado,Não Informado,Não Informado,Alexsander Robles Garcia - Bruno Ferreira da Silva
Thais Guaratini,Não Informado,Não Informado,Não Informado,Não Informado
Flavio Barbosa,Não Informado,Não Informado,Não Informado,Fabio Carmona - Marco Andrey Cipriani Frade
Alexandre Martinewski,Não Informado,Não Informado,Não Informado,Não Informado
Andréia Bagliotti Meneguin,Não Informado,Não Informado,Não Informado,Hernane da Silva Barud - Luis Alexandre Pedro de Freitas
Diego Fiori de Carvalho,Não Informado,Harley Francisco de Oliveira,Não Informado,Alexandre Colello Bruno
Hugo Cesar Pessotti,Não Informado,Não Informado,Não Informado,Não Informado
Rafael Mira de Oliveira Libardi,Não Informado,"Edgard Regolão Jr., Paul Chu Ngum",Não Informado,Stephan Reiff-Marganiec
Luciana Alves Tacon,Não Informado,Não Informado,Não Informado,Daniel Júnior de Andrade - Luis Alexandre Pedro de Freitas - Ricardo Antonio Polanczyk
Carlos Eduardo Junqueira Fonseca,Não Informado,Não Informado,Não Informado,Não Informado
Carolina Caliári Oliveira,Não Informado,Não Informado,Não Informado,Maria Beatriz Puzzi - Paula Tavares Colpas
Caio Margarido Moreira,Não Informado,Não Informado,Não Informado,João Pereira Leite - Marco Antonio Di Bonifacio - Victor Cavallari Souza
Ana Lígia Buzolin,Não Informado,Não Informado,Não Informado,Flavio Mavignier Cárcano - Marcos Tadeu dos Santos - Mariana Andozia Morini - Wesley Justino Magnabosco
Ana Luiza Scarano Aguillera Forte,Não Informado,Não Informado,Não Informado,Maria José Vieira Fonseca
Camillo Del Cistia Andrade,Não Informado,Não Informado,Não Informado,Não Informado
Juliana Issa Hori,Não Informado,Não Informado,Não Informado,Franciane Marquele de Oliveira - Thiago Mattar Cunha
Alessandra Aparecida Vireque,Não Informado,Não Informado,Não Informado,Não Informado
Mário César Souza e Silva,Não Informado,André Luiz Scridelli Silva,Não Informado,Álvaro de Baptista Neto - Luiz Alberto Beraldo de Moraes
Franciane Marquele de Oliveira,Não Informado,Andresa Aparecida Berretta e Silva,Não Informado,Anderson Rodrigo Moraes de Oliveira - Hernane da Silva Barud - Juliana Issa Hori - Lúcia Helena Faccioli - Sofia Nikolaou
Daniel Blasioli Dentillo,Não Informado,Dante Gavio,Não Informado,Benedito Antônio Lopes da Fonseca - Simone Kashima Haddad
Flavio Barbosa,Não Informado,Não Informado,Não Informado,Fabio Carmona - Marco Andrey Cipriani Frade
Reginaldo Aparecido Gotardo,Não Informado,Não Informado,Não Informado,Não Informado
Diego Fiori de Carvalho,Não Informado,Harley Francisco de Oliveira,Não Informado,Não Informado
Marcos Tadeu dos Santos,Não Informado,Não Informado,Não Informado,André Lopes Carvalho - Cristovam Scapulatempo Neto - Ricardo Ribeiro Gama
Thais Guaratini,Não Informado,Não Informado,Não Informado,Não Informado
Rogerio Bulha Siqueira,Não Informado,"Antonio Adilton Oliveira Carneiro, Rodrigo Pereira Barretto da Costa-Félix",Não Informado,Altacílio Aparecido Nunes - Jorge Elias Júnior - Marcello Henrique Nogueira Barbosa
Carolina Caliári Oliveira,Não Informado,Não Informado,Não Informado,Maria Beatriz Puzzi
Luciana Alves Tacon,Não Informado,Não Informado,Não Informado,Daniel Júnior de Andrade - Luis Alexandre Pedro de Freitas - Ricardo Antonio Polanczyk
Danilo Marques de Lima,Não Informado,Não Informado,Não Informado,Fernanda Ribeiro de Faria - Hubertt Kenned Elias Junior - Roseli Aparecida Ferrari
Felipe Wilker Grillo,Não Informado,Michelle Ferreira da Costa Abrahao,Não Informado,Não Informado
Daniela Spuri Bernardi,Não Informado,Não Informado,Não Informado,Harley Francisco de Oliveira - Peter van Hoogevest - Renata Fonseca Vianna Lopez
Juca Abramo Barrera San Martin,Não Informado,Não Informado,Não Informado,Norberto Peporine Lopes - Pablo Henrique Nunes - Túlio Marcos Nunes
Mirela de Barros Tamarozzi,Não Informado,Não Informado,Não Informado,Não Informado
Henrique Croisfelts,Não Informado,Não Informado,Não Informado,Não Informado
Carlos Eduardo Junqueira Fonseca,Não Informado,Não Informado,Não Informado,Não Informado
Sandra Rodrigues Pereira Faça,Não Informado,Não Informado,Não Informado,Não Informado
Franciane Marquele de Oliveira,Não Informado,Não Informado,Não Informado,Não Informado
Alessandra Aparecida Vireque,Não Informado,Não Informado,Não Informado,Não Informado
Luana Martins de Andrade da Cruz,Não Informado,Não Informado,Não Informado,Não Informado
Joel Aires Prates,Não Informado,Não Informado,Não Informado,Não Informado
Camillo Del Cistia Andrade,Não Informado,Não Informado,Não Informado,Não Informado
Fernando Lucas Primo,Não Informado,Não Informado,Não Informado,Não Informado
Maria Paula Garofo Peixoto,Não Informado,Não Informado,Não Informado,Não Informado
Cristiane Cardoso Correia Teixeira,Não Informado,Não Informado,Não Informado,Não Informado
Andresa Aparecida Berretta e Silva,Não Informado,Não Informado,Não Informado,Não Informado
Andresa Piacezzi Nascimento Rodrigues,Não Informado,Não Informado,Não Informado,Não Informado
Mario Tsukada,Não Informado,Não Informado,Não Informado,Não Informado
Thiago Antônio Moretti de Andrade,Não Informado,Não Informado,Não Informado,Não Informado
Hernane da Silva Barud,Não Informado,Não Informado,Não Informado,Não Informado
Sandro Gomes Soares,Não Informado,Não Informado,Não Informado,Não Informado
Sandra Rodrigues Pereira Faça,Não Informado,Não Informado,Não Informado,Não Informado
Fabiana Carina Pavezzi,Não Informado,Não Informado,Não Informado,Não Informado
Mario Sérgio Adolfi Júnior,Não Informado,Não Informado,Não Informado,Não Informado
Fernando Agostini Funk Thomaz,Não Informado,Não Informado,Não Informado,Não Informado
Andrea Fontoura,Não Informado,Não Informado,Não Informado,Não Informado
Gustavo Olszanski Acrani,Não Informado,Não Informado,Não Informado,Não Informado
Álvaro de Baptista Neto,Não Informado,Não Informado,Não Informado,Não Informado
Ebert Seixas Hanna,Não Informado,Não Informado,Não Informado,Não Informado
Andresa Aparecida Berretta e Silva,Não Informado,Não Informado,Não Informado,Não Informado
Leandro de Santis Ferreira,Não Informado,Não Informado,Não Informado,Não Informado
Eloisa Aparecida Mocheuti Kronka,Não Informado,Não Informado,Não Informado,Não Informado
Nínive Aguiar Colonello Frattini,Não Informado,Não Informado,Não Informado,Não Informado
Patricia de Oliveira Carminati,Não Informado,Não Informado,Não Informado,Não Informado
Thiago Wellington Joazeiro de Almeida,Não Informado,Não Informado,Não Informado,Não Informado
Camila Alves Areda,Não Informado,Não Informado,Não Informado,Não Informado
Christiane Martins de Lanna Salles Carvalho,Não Informado,Não Informado,Não Informado,Não Informado
Vitor Marcel Faça,Não Informado,Não Informado,Não Informado,Não Informado
Leandro de Santis Ferreira,Não Informado,Não Informado,Não Informado,Não Informado
Sandra Rodrigues Pereira Faça,Não Informado,Não Informado,Não Informado,Celio Lopes Silva - Daniela Maria Tomazela - Fabio Cícero de Sá Galetti - Vitor Marcel Faça
Renato Luis Tame Parreira,Não Informado,Não Informado,Não Informado,Não Informado
Hernane da Silva Barud,Não Informado,Não Informado,Não Informado,Não Informado
Álvaro de Baptista Neto,Não Informado,Não Informado,Não Informado,Não Informado
José Carlos Borges,Não Informado,Não Informado,Não Informado,Não Informado
Dalton Matsuo Tavares,Não Informado,Não Informado,Não Informado,Não Informado
Silvia Almeida Cardoso,Não Informado,Não Informado,Não Informado,Não Informado
Marcos Roberto Lourenzoni,Não Informado,Não Informado,Não Informado,Não Informado
Ivan Christensen Nali,Não Informado,Não Informado,Não Informado,Não Informado
Mario Tsukada,Não Informado,Não Informado,Não Informado,Não Informado
Leandro Licursi de Oliveira,Não Informado,Não Informado,Não Informado,Mirela de Barros Tamarozzi
Sandro Gomes Soares,Não Informado,Não Informado,Não Informado,Bergson Fogaça de Oliveira
Diego Fiori de Carvalho,Não Informado,Não Informado,Não Informado,Não Informado
Mairum Ceoldo Andrade,Não Informado,Não Informado,Não Informado,Não Informado
José Antonio Camacho Guerrero,Não Informado,Não Informado,Não Informado,Não Informado
Mozart de Azevedo Marins,Não Informado,Não Informado,Não Informado,Não Informado
Evamberto Garcia de Góes,Não Informado,Não Informado,Não Informado,Não Informado
José Carlos Pena Barbosa,Não Informado,Não Informado,Não Informado,Não Informado
Patrícia Nicolucci,Não Informado,Não Informado,Não Informado,Não Informado
Renato Glauco de Souza Rodrigues,Não Informado,Não Informado,Não Informado,Não Informado
Sergio Ulhoa Dani,Não Informado,Não Informado,Não Informado,Não Informado
Mario Alexandre Gazziro,Não Informado,Não Informado,Não Informado,Não Informado
Clemência Noriega Söndahl,Não Informado,Não Informado,Não Informado,Não Informado
José Carlos Borges,Não Informado,Não Informado,Não Informado,Não Informado
Renato Glauco de Souza Rodrigues,Não Informado,Não Informado,Não Informado,Não Informado
Pedro Gustavo Córdoba Junior,Não Informado,Não Informado,Não Informado,Não Informado
